{
  "schemaVersion": "0.1",
  "id": "AVE-2026-0009",
  "aliases": [
    "CVE-2025-3248"
  ],
  "published": "2026-09-19",
  "title": "Langflow before 1.3.0 executes unauthenticated code via its validation endpoint",
  "summary": "Langflow before 1.3.0 exposes a code-validation endpoint that executes submitted Python without authentication. Any instance reachable by an attacker is fully compromised. An instance bound to the local machine only is not remotely reachable.",
  "affected": {
    "all": [
      {
        "harness": {
          "name": "langflow",
          "versions": [
            "<1.3.0"
          ]
        }
      }
    ]
  },
  "notAffectedIf": [
    {
      "runtime": {
        "exposure": "local"
      }
    }
  ],
  "severity": "high",
  "impact": [
    "code-execution",
    "credential-theft"
  ],
  "attackVector": "network",
  "fixedBy": [
    {
      "upgrade": {
        "component": "harness",
        "name": "langflow",
        "version": "1.3.0"
      }
    },
    {
      "mitigation": "Do not expose the instance; bind locally or place it behind authentication",
      "set": {
        "runtime.exposure": "local"
      }
    }
  ],
  "references": [
    "https://horizon3.ai/attack-research/disclosures/unsafe-at-any-speed-abusing-python-exec-for-unauth-rce-in-langflow-ai/"
  ],
  "credit": [
    "Horizon3.ai"
  ]
}
