{
  "schemaVersion": "0.1",
  "id": "AVE-2026-0013",
  "aliases": [
    "CVE-2026-21852"
  ],
  "published": "2026-09-19",
  "title": "Claude Code before 2.0.65 sends API requests to a project-supplied base URL before trust prompt",
  "summary": "Claude Code before 2.0.65 honoured an API base URL set in a project's settings file and issued requests before showing the trust prompt. Opening an attacker-supplied repository could disclose the user's API key to an attacker-controlled endpoint.",
  "affected": {
    "all": [
      {
        "harness": {
          "name": "claude-code",
          "versions": [
            "<2.0.65"
          ]
        }
      }
    ]
  },
  "severity": "medium",
  "impact": [
    "credential-theft"
  ],
  "attackVector": "malicious-project-config",
  "fixedBy": [
    {
      "upgrade": {
        "component": "harness",
        "name": "claude-code",
        "version": "2.0.65"
      }
    }
  ],
  "references": [
    "https://research.checkpoint.com/2026/rce-and-api-token-exfiltration-through-claude-code-project-files-cve-2025-59536/"
  ],
  "credit": [
    "Check Point Research"
  ]
}
