{
  "schemaVersion": "0.1",
  "id": "AVE-2026-0006",
  "aliases": [
    "CVE-2025-53773"
  ],
  "published": "2026-09-19",
  "title": "GitHub Copilot agent mode can enable its own auto-approval by editing workspace settings",
  "summary": "In agent mode, Copilot could write to the workspace settings file without confirmation. Injected content instructs it to enable automatic tool approval, after which terminal commands run unconfirmed. The root condition is an agent able to modify its own approval configuration. Fixed in the August 2025 update; the sources reviewed do not give an exact fixed version, so this record matches on the setting rather than a version range.",
  "affected": {
    "all": [
      {
        "harness": {
          "name": [
            "github-copilot-chat",
            "vscode-copilot"
          ],
          "settings": {
            "configWriteApproval": "auto"
          }
        }
      }
    ]
  },
  "severity": "high",
  "impact": [
    "code-execution"
  ],
  "attackVector": "indirect-prompt-injection",
  "fixedBy": [
    {
      "mitigation": "Apply the August 2025 update, which requires approval before configuration files are edited",
      "set": {
        "harness.settings.configWriteApproval": "ask"
      }
    }
  ],
  "references": [
    "https://embracethered.com/blog/posts/2025/github-copilot-remote-code-execution-via-prompt-injection/"
  ],
  "credit": [
    "Johann Rehberger"
  ]
}
