{
  "schemaVersion": "0.1",
  "id": "AVE-2026-0008",
  "aliases": [
    "CVE-2026-25592"
  ],
  "published": "2026-09-19",
  "title": "Semantic Kernel (.NET) SessionsPythonPlugin exposes unvalidated file write to the model",
  "summary": "Semantic Kernel for .NET before 1.71.0 exposes DownloadFileAsync to the model as a callable function with no path validation. An agent configured with SessionsPythonPlugin can be driven by prompt input to write files outside the sandbox onto the host, reaching persistence and host compromise. Deployments without the plugin are not affected.",
  "affected": {
    "all": [
      {
        "harness": {
          "name": "semantic-kernel-dotnet",
          "versions": [
            "<1.71.0"
          ]
        }
      },
      {
        "tool": {
          "name": "SessionsPythonPlugin"
        }
      }
    ]
  },
  "severity": "high",
  "impact": [
    "integrity",
    "persistence",
    "code-execution"
  ],
  "attackVector": "indirect-prompt-injection",
  "fixedBy": [
    {
      "upgrade": {
        "component": "harness",
        "name": "semantic-kernel-dotnet",
        "version": "1.71.0"
      }
    }
  ],
  "references": [
    "https://www.microsoft.com/en-us/security/blog/2026/05/07/prompts-become-shells-rce-vulnerabilities-ai-agent-frameworks/"
  ],
  "credit": [
    "Microsoft Security"
  ]
}
