{
  "schemaVersion": "0.1",
  "id": "AVE-2026-0007",
  "aliases": [
    "CVE-2026-26030"
  ],
  "published": "2026-09-19",
  "title": "Semantic Kernel (Python) In-Memory Vector Store filter evaluates injected code",
  "summary": "Semantic Kernel for Python before 1.39.4 evaluates vector-store filter expressions with eval() behind a bypassable blocklist. An agent using the In-Memory Vector Store through the search plugin, and reachable by prompt injection, can be driven to execute code on the host. Deployments that do not use the In-Memory Vector Store are not affected.",
  "affected": {
    "all": [
      {
        "harness": {
          "name": "semantic-kernel-python",
          "versions": [
            "<1.39.4"
          ]
        }
      },
      {
        "tool": {
          "name": "in-memory-vector-store"
        }
      }
    ]
  },
  "severity": "high",
  "impact": [
    "code-execution"
  ],
  "attackVector": "indirect-prompt-injection",
  "fixedBy": [
    {
      "upgrade": {
        "component": "harness",
        "name": "semantic-kernel-python",
        "version": "1.39.4"
      }
    }
  ],
  "references": [
    "https://www.microsoft.com/en-us/security/blog/2026/05/07/prompts-become-shells-rce-vulnerabilities-ai-agent-frameworks/"
  ],
  "credit": [
    "Microsoft Security"
  ]
}
